GCPDS/ANE2/maintenance/qualityAssurance/modules/spectrumAnalysis/narrowband/preprocess/IQmanagement/src/test/iqMethods/prslIQ/src/py/best_method_python_metrics.json

{
  "best_method": "Metodo 3 IQ",
  "files": 6,
  "samples_total": 157286400,
  "load_ms_total": 875.2327999100089,
  "convert_ms_total": 2481.1758000287227,
  "welch_ms_total": 36182.09349992685,
  "metric_ms_total": 0.01409999094903469,
  "kde_ms_total": 4.997199983336031,
  "total_ms": 39544.82300003292,
  "rss_start_mb": 384.296875,
  "rss_end_mb": 384.26171875,
  "rss_delta_mb": -0.03515625,
  "snr_mean_db": 3.004906972249349,
  "snr_std_db": 0.05224979900355979,
  "noise_mean_dbm": -74.48205693562825,
  "center_mean_dbm": -71.4771499633789
}

GCPDS/ANE2/maintenance/qualityAssurance/modules/spectrumAnalysis/narrowband/preprocess/IQmanagement/src/test/prslIQ/docs/inference.md

# first on PY :  

Best method                 : Metodo 3 IQ
Files processed             : 6
Total samples               : 157,286,400
Total runtime               : 39544.82 ms
Avg runtime per file        : 6590.80 ms
Throughput                  : 3,977,420.76 samples/s
SNR mean +- std             : 3.0049 +- 0.0522 dB
Noise floor mean            : -74.4821 dBm
Center power mean           : -71.4771 dBm
RSS delta                   : -0.0352 MB

### meassurement quality and computational cost

5) Métricas de calidad de señal aún no equivalentes
- Diferencias notables:
- SNR medio: Python 3.00 dB vs C 13.00 dB
- Potencia central: Python -71.48 dBm vs C -60.26 dBm